{
  "version": "0.2.3",
  "composables": {
    "useForm": {
      "summary": "Vue composable for complete form lifecycle.",
      "options": [
        {
          "name": "data",
          "type": "T",
          "required": true,
          "description": "Initial form data (required)"
        },
        {
          "name": "rules",
          "type": "Record<string, Rule<T>[]> | undefined",
          "required": false,
          "description": "Validation rules by dot-path\nSupports wildcards for arrays: 'items.*.name'"
        },
        {
          "name": "endpoint",
          "type": "string | undefined",
          "required": false,
          "description": "Submission endpoint URL"
        },
        {
          "name": "method",
          "type": "\"POST\" | \"PUT\" | \"PATCH\" | \"DELETE\" | undefined",
          "required": false,
          "description": "HTTP method for submission (default: POST)"
        },
        {
          "name": "transform",
          "type": "((data: T) => unknown) | undefined",
          "required": false,
          "description": "Transform data before submission"
        }
      ],
      "returns": [
        {
          "name": "data",
          "type": "Ref<T, T>",
          "description": "Reactive form data"
        },
        {
          "name": "errors",
          "type": "Ref<Record<string, string[]>, Record<string, string[]>>",
          "description": "Per-path error arrays (dot-notation keys)"
        },
        {
          "name": "isDirty",
          "type": "ComputedRef<boolean>",
          "description": "True if data differs from initial snapshot"
        },
        {
          "name": "isValid",
          "type": "ComputedRef<boolean>",
          "description": "True if no errors and all rules pass"
        },
        {
          "name": "isSubmitting",
          "type": "Ref<boolean, boolean>",
          "description": "True while submission is in progress"
        },
        {
          "name": "hasErrors",
          "type": "ComputedRef<boolean>",
          "description": "True if any errors exist"
        },
        {
          "name": "submit",
          "type": "() => Promise<SubmitResult<R>>",
          "description": "Submit the form"
        },
        {
          "name": "reset",
          "type": "() => void",
          "description": "Reset form to initial state"
        },
        {
          "name": "validate",
          "type": "() => boolean",
          "description": "Run client-side validation"
        },
        {
          "name": "setError",
          "type": "(path: string, message: string) => void",
          "description": "Set an error for a path"
        },
        {
          "name": "clearErrors",
          "type": "(path?: string | undefined) => void",
          "description": "Clear errors (all or for a specific path)"
        }
      ]
    },
    "usePagination": {
      "summary": "Vue composable for server-side paginated data fetching.",
      "options": [
        {
          "name": "endpoint",
          "type": "string",
          "required": true,
          "description": "API endpoint to fetch paginated data from (required)"
        },
        {
          "name": "perPage",
          "type": "number | undefined",
          "required": false,
          "description": "Number of items per page (default: 25)"
        },
        {
          "name": "params",
          "type": "Ref<Record<string, unknown>, Record<string, unknown>> | ComputedRef<Record<string, unknown>> | undefined",
          "required": false,
          "description": "Reactive query params to include in requests.\nAny change triggers a refetch and resets to page 1."
        },
        {
          "name": "syncUrl",
          "type": "boolean | undefined",
          "required": false,
          "description": "Sync pagination state with URL query params (default: false)"
        }
      ],
      "returns": [
        {
          "name": "rows",
          "type": "Ref<T[], T[]>",
          "description": "Current page of data"
        },
        {
          "name": "meta",
          "type": "Ref<PaginationMeta | null, PaginationMeta | null>",
          "description": "Pagination metadata (null before first fetch)"
        },
        {
          "name": "isLoading",
          "type": "Ref<boolean, boolean>",
          "description": "Whether a request is in flight"
        },
        {
          "name": "error",
          "type": "Ref<Error | null, Error | null>",
          "description": "Error from last request (null on success)"
        },
        {
          "name": "goToPage",
          "type": "(page: number) => void",
          "description": "Navigate to a specific page"
        },
        {
          "name": "nextPage",
          "type": "() => void",
          "description": "Navigate to next page"
        },
        {
          "name": "prevPage",
          "type": "() => void",
          "description": "Navigate to previous page"
        },
        {
          "name": "firstPage",
          "type": "() => void",
          "description": "Navigate to first page"
        },
        {
          "name": "lastPage",
          "type": "() => void",
          "description": "Navigate to last page"
        },
        {
          "name": "refresh",
          "type": "() => Promise<void>",
          "description": "Manually refresh current page"
        }
      ]
    },
    "useInfiniteScroll": {
      "summary": "Infinite scroll composable for Vue 3\n\nAutomatically loads more data as the user scrolls, using IntersectionObserver\nfor performance.",
      "options": [
        {
          "name": "perPage",
          "type": "number | undefined",
          "required": false,
          "description": "Number of items per page (default: 15)"
        },
        {
          "name": "scrollElement",
          "type": "Ref<HTMLElement | null, HTMLElement | null> | (() => HTMLElement | null) | undefined",
          "required": false,
          "description": "Element to observe for scroll position.\nCan be a ref, a function returning an element, or undefined for window."
        },
        {
          "name": "threshold",
          "type": "number | undefined",
          "required": false,
          "description": "Distance from bottom (in px) to trigger loading (default: 200)"
        },
        {
          "name": "immediate",
          "type": "boolean | undefined",
          "required": false,
          "description": "Start loading automatically on mount (default: true)"
        },
        {
          "name": "cursor",
          "type": "boolean | undefined",
          "required": false,
          "description": "Use cursor-based pagination instead of page numbers"
        },
        {
          "name": "params",
          "type": "Record<string, string | number | boolean> | undefined",
          "required": false,
          "description": "Custom query params to include with each request"
        },
        {
          "name": "direction",
          "type": "\"down\" | \"up\" | undefined",
          "required": false,
          "description": "Direction to load more items: 'down' appends, 'up' prepends (default: 'down')"
        },
        {
          "name": "transform",
          "type": "((item: unknown) => T) | undefined",
          "required": false,
          "description": "Transform each item after fetching"
        },
        {
          "name": "keyField",
          "type": "keyof T | undefined",
          "required": false,
          "description": "Unique key field for deduplication (default: 'id')"
        },
        {
          "name": "http",
          "type": "typeof Http | undefined",
          "required": false,
          "description": "Custom HTTP instance to use"
        }
      ],
      "returns": [
        {
          "name": "items",
          "type": "Ref<Collection<T>, Collection<T>>",
          "description": "All loaded items as a reactive Collection"
        },
        {
          "name": "loading",
          "type": "Ref<boolean, boolean>",
          "description": "Whether currently loading"
        },
        {
          "name": "hasMore",
          "type": "Ref<boolean, boolean>",
          "description": "Whether there are more items to load"
        },
        {
          "name": "error",
          "type": "Ref<Error | null, Error | null>",
          "description": "Any error that occurred"
        },
        {
          "name": "page",
          "type": "Ref<string | number, string | number>",
          "description": "Current page number (or cursor)"
        },
        {
          "name": "total",
          "type": "Ref<number | null, number | null>",
          "description": "Total number of items (if known)"
        },
        {
          "name": "loadMore",
          "type": "() => Promise<void>",
          "description": "Manually load more items"
        },
        {
          "name": "reset",
          "type": "() => Promise<void>",
          "description": "Reset and reload from the beginning"
        },
        {
          "name": "refresh",
          "type": "() => Promise<void>",
          "description": "Reload current data without resetting"
        },
        {
          "name": "sentinelRef",
          "type": "Ref<HTMLElement | null, HTMLElement | null>",
          "description": "Ref to attach to the sentinel element for intersection observation"
        }
      ]
    },
    "useLiveData": {
      "summary": "Live data composable for Vue 3\n\nFetches data via HTTP and keeps it synchronized via WebSocket.",
      "options": [
        {
          "name": "channel",
          "type": "string | undefined",
          "required": false,
          "description": "WebSocket channel to subscribe to"
        },
        {
          "name": "event",
          "type": "string | undefined",
          "required": false,
          "description": "Specific event name to listen for"
        },
        {